{
  "version_id": "policy-3.1.0",
  "parent_version_id": "policy-3.0.0",
  "status": "active",
  "created_at": "2026-07-15T00:00:00Z",
  "created_by": "phase-03c-governance-integration",
  "change_reason": "Promote the Phase 03B derived-refinement rules into a first-class, versioned, schema-validated and hash-verified policy component (derived_refinement_rules). Parent policy-3.0.0 is preserved for rollback; a rollback drops the component and restores the pre-derived behavior.",
  "components": {
    "policy_rules": "b5b1249c8258ab1fe47743b5ad22682e105fd1e7dfffa2bc1696269f163a6f2a",
    "baseline_intent_rules": "9c5c11132f3064061bc489998082978e04b92db9d08048b0516211aeceac05ac",
    "redaction_policy": "dfd268c30647ebb56c417b58765e4512d3fd1e713c69c951b25a0984e045018a",
    "market_overlays": "8c602c5a6461eded53e262790508f3fced2414ac4627fcaf8e851331b53196c6",
    "auto_response_templates": "e7d5da60a6c7b02b33de5605e94b4465265981a2b2ce8816191775c6aeb64304",
    "rationale_templates": "223f07aad502f20633335b6c8b2675af7163f0651fea7d4caf33f83e04aee1a7",
    "semantic_constraints": "ee8fb892ea909755159099a49c47c01b0c827bdd2aceffabbb8634fea6317867",
    "derived_refinement_rules": "e0c6ec083aa0fd914b78b02bb72a407e8baffb0b727b485bf76d604aee5c11c4"
  },
  "validation_summary": null,
  "impact_summary": null,
  "activation_event_id": null
}
